[{"caption":"0 \n20 \n40 \n60 \n80 \n100 \n120 \n140 \n\nMillion Frames \n\n0 \n\n100 \n\n200 \n\n300 \n\n400 \n\n500 \n\n600 \n\nAverage Score \n\nGravitar \n\nDQN \nDQN-MC \nDQN-CTS \nDQN-ConvCTS \nDQN-PixelCNN \n\n0 \n20 \n40 \n60 \n80 \n100 \n120 \n140 \n\nMillion Frames \n\n0 \n\n500 \n\n1000 \n\n1500 \n\n2000 \n\n2500 \n\n3000 \n\n3500 \n\n4000 \n\nAverage Score \n\nMontezuma\u0027s Revenge \n\nDQN \nDQN-MC \nDQN-CTS \nDQN-ConvCTS \nDQN-PixelCNN \n\n0 \n20 \n40 \n60 \n80 \n100 \n120 \n140 \n\nMillion Frames \n\n2000 \n\n0 \n\n2000 \n\n4000 \n\n6000 \n\n8000 \n\n10000 \n\n12000 \n\n14000 \n\n16000 \n\nAverage Score \n\nPrivate Eye \n\nDQN \nDQN-MC \nDQN-CTS \nDQN-ConvCTS \nDQN-PixelCNN \n\n0 \n20 \n40 \n60 \n80 \n100 \n120 \n140 \n\nMillion Frames \n\n0 \n\n1000 \n\n2000 \n\n3000 \n\n4000 \n\n5000 \n\n6000 \n\n7000 \n\n8000 \n\nAverage Score \n\nQ*Bert \n\nDQN \nDQN-MC \nDQN-CTS \nDQN-ConvCTS \nDQN-PixelCNN \n\n0 \n20 \n40 \n60 \n80 \n100 \n120 \n140 \n\nMillion Frames \n\n0 \n\n200 \n\n400 \n\n600 \n\n800 \n\n1000 \n\n1200 \n\nAverage Score \n\nVenture \n\nDQN \nDQN-MC \nDQN-CTS \nDQN-ConvCTS \nDQN-PixelCNN \n\n0 \n20 \n40 \n60 \n80 \n100 \n120 \n140 \n\nMillion Frames \n\n0 \n\n2000 \n\n4000 \n\n6000 \n\n8000 \n\n10000 \n\nAverage Score \n\nZaxxon \n\nDQN \nDQN-MC \nDQN-CTS \nDQN-ConvCTS \nDQN-PixelCNN \n\nFigure 14. Comparison of DQN, DQN-CTS, DQN-ConvCTS and DQN-PixelCNN training performance. \n\nEasy Exploration \nHard Exploration \n\nHuman-Optimal \nScore Exploit \nDense Reward \nSparse Reward \n\nASSAULT \nASTERIX \nBEAM RIDER \nALIEN \nFREEWAY \nASTEROIDS \nATLANTIS \nKANGAROO \nAMIDAR \nGRAVITAR \nBATTLE ZONE \nBERZERK \nKRULL \nBANK HEIST \nMONTEZUMA\u0027S REVENGE \nBOWLING \nBOXING \nKUNG-FU MASTER \nFROSTBITE \nPITFALL! \nBREAKOUT \nCENTIPEDE \nROAD RUNNER \nH.E.R.O. \nPRIVATE EYE \nCHOPPER CMD \nCRAZY CLIMBER \nSEAQUEST \nMS. PAC-MAN \nSOLARIS \nDEFENDER \nDEMON ATTACK \nUP N DOWN \nQ*BERT \nVENTURE \nDOUBLE DUNK \nENDURO \nTUTANKHAM \nSURROUND \nFISHING DERBY \nGOPHER \nWIZARD OF WOR \nICE HOCKEY \nJAMES BOND \nZAXXON \nNAME THIS GAME \nPHOENIX \nPONG \nRIVER RAID \nROBOTANK \nSKIING \nSPACE INVADERS \nSTARGUNNER \n\nTable 1. A rough taxonomy of Atari 2600 games according to their exploration difficulty. \n\n","rows":["0","DQN","DQN - ConvCTS","Score","4000","DQN - CTS","Average","80","60","40","20"],"columns":["DQN - ConvCTS","Private Eye","Zaxxon","Million Frames","Venture","1000","3000","DQN - PixelCNN","DQN - MC","2500","Q * Bert","DQN","16000","8000","4000","12000","DQN - CTS","14000","Average","2000","Gravitar","0","Score","1500","3500","Montezuma \u0027 s Revenge","1200","10000"],"mergedAllColumns":["0","6000","2000"],"numberCells":[{"number":"100","isBolded":false,"associatedRows":["Average","0","20","40","60","80","DQN - ConvCTS","Average","0","20","40","60","80","0","20","40","60","80"],"associatedColumns":["Private Eye","14000","12000","DQN","DQN - MC","DQN - CTS","Average","DQN - PixelCNN","2000","2000","Million Frames","Zaxxon","10000","DQN","DQN - MC","DQN - CTS","DQN - ConvCTS","DQN - PixelCNN","4000","DQN - PixelCNN"],"associatedMergedColumns":["2000"]},{"number":"400","isBolded":false,"associatedRows":["Average","60","80","DQN - CTS","Average"],"associatedColumns":["4000","3500","DQN - MC","3000","2500","2000","1500","1000","0","Million Frames","1200","DQN","1000","8000","DQN - CTS","DQN - ConvCTS","DQN - PixelCNN","4000"],"associatedMergedColumns":["6000"]},{"number":"500","isBolded":false,"associatedRows":["Score"],"associatedColumns":["Gravitar"],"associatedMergedColumns":[]},{"number":"200","isBolded":false,"associatedRows":["Average"],"associatedColumns":["Gravitar","DQN","DQN - MC","DQN - CTS","DQN - ConvCTS","DQN - PixelCNN","2000"],"associatedMergedColumns":[]},{"number":"300","isBolded":false,"associatedRows":["Average"],"associatedColumns":["Gravitar","DQN","DQN - MC","DQN - CTS","DQN - ConvCTS"],"associatedMergedColumns":[]},{"number":"100","isBolded":false,"associatedRows":["Average"],"associatedColumns":["Gravitar","DQN","DQN - MC","DQN - CTS","DQN - ConvCTS","DQN - PixelCNN","Average","1500","1000"],"associatedMergedColumns":[]},{"number":"120","isBolded":false,"associatedRows":["Average","0","20","40","60","80"],"associatedColumns":["Gravitar","3500","DQN - MC","Score","Average","2000","1500","1000"],"associatedMergedColumns":["0"]},{"number":"500","isBolded":false,"associatedRows":["Average","60","80","DQN","Score"],"associatedColumns":["4000","3500","DQN - MC","3000","2500","2000","1500","1000"],"associatedMergedColumns":[]},{"number":"140","isBolded":false,"associatedRows":["Average","0","20","40","60","80","DQN - ConvCTS","Average","0","20","40","60","80","0","20","40","60","80"],"associatedColumns":["Private Eye","14000","12000","DQN","DQN - MC","DQN - CTS","Average","DQN - PixelCNN","2000","2000","Million Frames","Zaxxon","10000","DQN","DQN - MC","DQN - CTS","DQN - ConvCTS","DQN - PixelCNN","4000","DQN - PixelCNN"],"associatedMergedColumns":["2000"]},{"number":"120","isBolded":false,"associatedRows":["Average","0","20","40","60","80","DQN - ConvCTS","Average","0","20","40","60","80","0","20","40","60","80"],"associatedColumns":["Private Eye","14000","12000","DQN","DQN - MC","DQN - CTS","Average","DQN - PixelCNN","2000","2000","Million Frames","Zaxxon","10000","DQN","DQN - MC","DQN - CTS","DQN - ConvCTS","DQN - PixelCNN","4000","DQN - PixelCNN"],"associatedMergedColumns":["2000"]},{"number":"200","isBolded":false,"associatedRows":["Average","60","80","DQN - ConvCTS","Average"],"associatedColumns":["4000","3500","DQN - MC","3000","2500","2000","1500","1000","0","Million Frames","1200","DQN","1000","8000","DQN - CTS","DQN - ConvCTS","DQN - PixelCNN","DQN - MC"],"associatedMergedColumns":["2000"]},{"number":"140","isBolded":false,"associatedRows":["Average","0","20","40","60","80","DQN - ConvCTS","Score","0","20","40","60","80"],"associatedColumns":["16000","14000","12000","Score","8000","Average","2000"],"associatedMergedColumns":["0"]},{"number":"100","isBolded":false,"associatedRows":["Average","0","20","40","60","80","DQN - ConvCTS","Average","0","20","40","60","80"],"associatedColumns":["Montezuma \u0027 s Revenge","14000","DQN - MC","Score","DQN - ConvCTS","DQN - PixelCNN","Average","2000","2000","Million Frames","Venture","10000","DQN","DQN - MC","8000","Score","DQN - ConvCTS","DQN - PixelCNN","Average","DQN - PixelCNN"],"associatedMergedColumns":["2000"]},{"number":"120","isBolded":false,"associatedRows":["Average","0","20","40","60","80","DQN - ConvCTS","Score","0","20","40","60","80"],"associatedColumns":["Montezuma \u0027 s Revenge","14000","12000","Score","8000","Average","2000"],"associatedMergedColumns":["0"]},{"number":"140","isBolded":false,"associatedRows":["Average","0","20","40","60","80","DQN"],"associatedColumns":["4000","3500","DQN - MC","Score","Average","2000","1500","1000"],"associatedMergedColumns":["0"]},{"number":"100","isBolded":false,"associatedRows":["Average","0","20","40","60","80"],"associatedColumns":["Gravitar","3500","DQN - MC","Score","DQN - ConvCTS","DQN - PixelCNN","Average","1500","1000","0","Million Frames","Q * Bert","1200","DQN","1000","8000","DQN - CTS","DQN - ConvCTS","DQN - PixelCNN","DQN - MC","DQN - PixelCNN"],"associatedMergedColumns":["2000"]},{"number":"100","isBolded":false,"associatedRows":["Average","0","20","40","60","80","DQN - ConvCTS","Score","0","20","40","60","80","0","20","40","60","80"],"associatedColumns":["Private Eye","14000","12000","DQN","DQN - MC","DQN - CTS","Average","DQN - PixelCNN","2000"],"associatedMergedColumns":["0"]},{"number":"600","isBolded":false,"associatedRows":["Score"],"associatedColumns":[],"associatedMergedColumns":[]},{"number":"100","isBolded":false,"associatedRows":["Average","0","20","40","60","80","DQN - ConvCTS","Score","0","20","40","60","80"],"associatedColumns":["Montezuma \u0027 s Revenge","14000","DQN - MC","Score","DQN - ConvCTS","DQN - PixelCNN","Average","2000"],"associatedMergedColumns":["0"]},{"number":"400","isBolded":false,"associatedRows":["Score"],"associatedColumns":["Gravitar","DQN","DQN - MC","3000"],"associatedMergedColumns":[]},{"number":"800","isBolded":false,"associatedRows":["Score","60","80","DQN - ConvCTS","Score"],"associatedColumns":["4000","3500","DQN - MC","3000","2500","2000","1500","1000","0","Million Frames","1200","DQN","1000","8000"],"associatedMergedColumns":["6000"]},{"number":"100","isBolded":false,"associatedRows":["Average","0","20","40","60","80"],"associatedColumns":["Gravitar","3500","DQN - MC","Score","DQN - ConvCTS","DQN - PixelCNN","Average","1500","1000"],"associatedMergedColumns":["0"]},{"number":"120","isBolded":false,"associatedRows":["Average","0","20","40","60","80","DQN - ConvCTS","Score","0","20","40","60","80","0","20","40","60","80"],"associatedColumns":["Private Eye","14000","12000","DQN","DQN - MC","DQN - CTS","Average","DQN - PixelCNN","2000"],"associatedMergedColumns":["0"]},{"number":"140","isBolded":false,"associatedRows":["Average","0","20","40","60","80","DQN - ConvCTS","Average","0","20","40","60","80"],"associatedColumns":["16000","14000","12000","Score","8000","Average","2000","2000","Million Frames","10000","DQN","DQN - MC","8000","Score","DQN - PixelCNN","Average","DQN - PixelCNN"],"associatedMergedColumns":["2000"]},{"number":"140","isBolded":false,"associatedRows":["Average","0","20","40","60","80","DQN - CTS"],"associatedColumns":["4000","3500","DQN - MC","Score","Average","2000","1500","1000","0","Million Frames","1200","DQN","1000","8000","DQN - CTS","DQN - ConvCTS","DQN - PixelCNN","DQN - MC","DQN - PixelCNN"],"associatedMergedColumns":["2000"]},{"number":"120","isBolded":false,"associatedRows":["Average","0","20","40","60","80"],"associatedColumns":["Gravitar","3500","DQN - MC","Score","Average","2000","1500","1000","0","Million Frames","Q * Bert","1200","DQN","1000","8000","DQN - CTS","DQN - ConvCTS","DQN - PixelCNN","DQN - MC","DQN - PixelCNN"],"associatedMergedColumns":["2000"]},{"number":"140","isBolded":false,"associatedRows":["Average","0","20","40","60","80","DQN - ConvCTS","Score","0","20","40","60","80","0","20","40","60","80"],"associatedColumns":["Private Eye","14000","12000","DQN","DQN - MC","DQN - CTS","Average","DQN - PixelCNN","2000"],"associatedMergedColumns":["0"]},{"number":"120","isBolded":false,"associatedRows":["Average","0","20","40","60","80","DQN - ConvCTS","Average","0","20","40","60","80"],"associatedColumns":["Montezuma \u0027 s Revenge","14000","12000","Score","8000","Average","2000","2000","Million Frames","Venture","10000","DQN","DQN - MC","8000","Score","DQN - PixelCNN","Average","DQN - PixelCNN"],"associatedMergedColumns":["2000"]},{"number":"600","isBolded":false,"associatedRows":["Average","4000","60","80","DQN","Average"],"associatedColumns":["4000","3500","DQN - MC","3000","2500","2000","1500","1000","0","Million Frames","1200","DQN","1000","8000","DQN - CTS","DQN - ConvCTS"],"associatedMergedColumns":["6000"]}]},{"caption":"DQN A3C-CTS Prior. Duel \nDQN-CTS DQN-PixelCNN \nFREEWAY \n30.8 \n30.48 \n33.0 \n31.7 \n31.7 \nGRAVITAR \n473.0 \n238.68 \n238.0 \n498.3 \n859.1 \nMONTEZUMA\u0027S REVENGE \n0.0 \n273.70 \n0.0 \n3705.5 \n2514.3 \nPITFALL! \n-286.1 \n-259.09 \n0.0 \n0.0 \n0.0 \nPRIVATE EYE \n146.7 \n99.32 \n206.0 \n8358.7 \n15806.5 \nSOLARIS 3,482.8 \n2270.15 \n133.4 \n2863.6 \n5501.5 \nVENTURE \n163.0 \n0.00 \n48.0 \n82.2 \n1356.25 \n\nTable 2. Comparison with previously published results on hard exploration, sparse reward games. The compared agents are DQN (Mnih \net al., 2015), A3C-CTS (\"A3C+\" in (Bellemare et al., 2016)), Prioritized Dueling DQN (Wang et al., 2016), and the basic versions of \nDQN-CTS and DQN-PixelCNN from Section 4. For our agents we report the maximum scores achieved over 150M frames of training, \naveraged over 3 seeds. \n","rows":["GRAVITAR","MONTEZUMA \u0027 S REVENGE","PITFALL !","PRIVATE EYE","SOLARIS","3 , 482 . 8","VENTURE","FREEWAY"],"columns":["DQN","DQN - PixelCNN","A3C - CTS","Prior . Duel","DQN - CTS"],"mergedAllColumns":[],"numberCells":[{"number":"30.48","isBolded":false,"associatedRows":["MONTEZUMA \u0027 S REVENGE","FREEWAY"],"associatedColumns":["A3C - CTS"],"associatedMergedColumns":[]},{"number":"99.32","isBolded":false,"associatedRows":["PRIVATE EYE"],"associatedColumns":["A3C - CTS"],"associatedMergedColumns":[]},{"number":"30.8","isBolded":false,"associatedRows":["MONTEZUMA \u0027 S REVENGE","FREEWAY"],"associatedColumns":["DQN"],"associatedMergedColumns":[]},{"number":"1356.25","isBolded":true,"associatedRows":["VENTURE"],"associatedColumns":["DQN - PixelCNN"],"associatedMergedColumns":[]},{"number":"15806.5","isBolded":true,"associatedRows":["PRIVATE EYE"],"associatedColumns":["DQN - PixelCNN"],"associatedMergedColumns":[]},{"number":"82.2","isBolded":false,"associatedRows":["VENTURE"],"associatedColumns":["DQN - CTS"],"associatedMergedColumns":[]},{"number":"238.68","isBolded":false,"associatedRows":["MONTEZUMA \u0027 S REVENGE","GRAVITAR"],"associatedColumns":["A3C - CTS"],"associatedMergedColumns":[]},{"number":"2863.6","isBolded":false,"associatedRows":["SOLARIS","3 , 482 . 8"],"associatedColumns":["DQN - CTS"],"associatedMergedColumns":[]},{"number":"0.0","isBolded":false,"associatedRows":["MONTEZUMA \u0027 S REVENGE","GRAVITAR"],"associatedColumns":["Prior . Duel"],"associatedMergedColumns":[]},{"number":"206.0","isBolded":false,"associatedRows":["PRIVATE EYE"],"associatedColumns":["Prior . Duel"],"associatedMergedColumns":[]},{"number":"33.0","isBolded":true,"associatedRows":["MONTEZUMA \u0027 S REVENGE","FREEWAY"],"associatedColumns":["Prior . Duel"],"associatedMergedColumns":[]},{"number":"2514.3","isBolded":false,"associatedRows":["MONTEZUMA \u0027 S REVENGE","GRAVITAR"],"associatedColumns":["DQN - PixelCNN"],"associatedMergedColumns":[]},{"number":"859.1","isBolded":true,"associatedRows":["MONTEZUMA \u0027 S REVENGE","GRAVITAR"],"associatedColumns":["DQN - PixelCNN"],"associatedMergedColumns":[]},{"number":"273.70","isBolded":false,"associatedRows":["MONTEZUMA \u0027 S REVENGE","GRAVITAR"],"associatedColumns":["A3C - CTS"],"associatedMergedColumns":[]},{"number":"163.0","isBolded":false,"associatedRows":["VENTURE"],"associatedColumns":["DQN"],"associatedMergedColumns":[]},{"number":"-286.1","isBolded":false,"associatedRows":["PITFALL !"],"associatedColumns":["DQN"],"associatedMergedColumns":[]},{"number":"0.0","isBolded":true,"associatedRows":["PITFALL !"],"associatedColumns":["DQN - CTS"],"associatedMergedColumns":[]},{"number":"2270.15","isBolded":false,"associatedRows":["SOLARIS","3 , 482 . 8"],"associatedColumns":["A3C - CTS"],"associatedMergedColumns":[]},{"number":"8358.7","isBolded":false,"associatedRows":["PRIVATE EYE"],"associatedColumns":["DQN - CTS"],"associatedMergedColumns":[]},{"number":"0.0","isBolded":false,"associatedRows":["MONTEZUMA \u0027 S REVENGE","GRAVITAR"],"associatedColumns":["DQN"],"associatedMergedColumns":[]},{"number":"0.0","isBolded":true,"associatedRows":["PITFALL !"],"associatedColumns":["Prior . Duel"],"associatedMergedColumns":[]},{"number":"133.4","isBolded":false,"associatedRows":["SOLARIS","3 , 482 . 8"],"associatedColumns":["Prior . Duel"],"associatedMergedColumns":[]},{"number":"238.0","isBolded":false,"associatedRows":["MONTEZUMA \u0027 S REVENGE","GRAVITAR"],"associatedColumns":["Prior . Duel"],"associatedMergedColumns":[]},{"number":"473.0","isBolded":false,"associatedRows":["MONTEZUMA \u0027 S REVENGE","GRAVITAR"],"associatedColumns":["DQN"],"associatedMergedColumns":[]},{"number":"0.0","isBolded":true,"associatedRows":["PITFALL !"],"associatedColumns":["DQN - PixelCNN"],"associatedMergedColumns":[]},{"number":"146.7","isBolded":false,"associatedRows":["PRIVATE EYE"],"associatedColumns":["DQN"],"associatedMergedColumns":[]},{"number":"3705.5","isBolded":true,"associatedRows":["MONTEZUMA \u0027 S REVENGE","GRAVITAR"],"associatedColumns":["DQN - CTS"],"associatedMergedColumns":[]},{"number":"31.7","isBolded":false,"associatedRows":["MONTEZUMA \u0027 S REVENGE","FREEWAY"],"associatedColumns":["DQN - PixelCNN"],"associatedMergedColumns":[]},{"number":"5501.5","isBolded":true,"associatedRows":["SOLARIS","3 , 482 . 8"],"associatedColumns":["DQN - PixelCNN"],"associatedMergedColumns":[]},{"number":"-259.09","isBolded":false,"associatedRows":["PITFALL !"],"associatedColumns":["A3C - CTS"],"associatedMergedColumns":[]},{"number":"0.00","isBolded":false,"associatedRows":["VENTURE"],"associatedColumns":["A3C - CTS"],"associatedMergedColumns":[]},{"number":"498.3","isBolded":false,"associatedRows":["MONTEZUMA \u0027 S REVENGE","GRAVITAR"],"associatedColumns":["DQN - CTS"],"associatedMergedColumns":[]},{"number":"48.0","isBolded":false,"associatedRows":["VENTURE"],"associatedColumns":["Prior . Duel"],"associatedMergedColumns":[]},{"number":"31.7","isBolded":false,"associatedRows":["MONTEZUMA \u0027 S REVENGE","FREEWAY"],"associatedColumns":["DQN - CTS"],"associatedMergedColumns":[]}]}]