[{"caption":"Test (3) \n\nF1 \n\n(%) \n\nPrecision \n\n(%) \n\nRecall \n\n(%) \n\nTREC \nEVAL \n(a) \nDeepPatent \nIPC+Title+Abstract \nEPO+WIP \nO \n\nEPO \nN/A \n83.98 \nN/A \nTop 1 \n\n(b) \nDeepPatent \nIPC+Title+Abstract \n2006~2014 \n2015-A \nN/A \n73.88 \nN/A \nTop 1 \n(c) \nDeepPatent \nIPC+Title+Abstract \nEPO+WIP \nO \n\nEPO \n55.09 \n45.79 \n75.46 \nTop 4 \n\n(d) \nDeepPatent \nIPC+Title+Abstract \n2006~2014 \n2015-A \n\u003c 45 \n\u003c 35 \n\u003c 74 \nTop 5 \n(e) PatentBERT IPC+Title+Abstract \n2006~2014 \n2015-A 46.85 \n32.19 \n86.06 \nTop 5 \n(f) \nPatentBERT \nIPC+Title+Abstract \n2006~2014 \n2015-A 64.91 \n80.61 \n54.33 \nTop 1 \n(g) \nPatentBERT \nIPC+Claim \n2006~2014 \n2015-A 63.74 \n79.14 \n53.36 \nTop 1 \n(h) \nPatentBERT \nCPC+Claim \n2006~2014 \n2015-A 66.83 \n84.26 \n55.38 \nTop 1 \n(i) \nPatentBERT \nCPC+Claim \n2006~2014 \n2015-B 66.80 \n84.24 \n55.35 \nTop 1 \n(j) \nPatentBERT \nCPC+Claim \n2000~2014 \n2015-B 66.71 \n84.95 \n54.92 \nTop 1 \n(k) \nPatentBERT \nCPC+Claim \n2000~2014 \n2016 \n65.89 \n84.89 \n53.84 \nTop 1 \n(l) \nPatentBERT \nCPC+Claim \n2000~2014 \n2017 \n65.35 \n83.97 \n53.49 \nTop 1 \n(1) IPC subclass level: 632 labels. CPC subclass level: 656 labels \n(2) Training dataset size: \n? EPO: 580,546 patents. WIPO: 161,551 patents. \n? USPTO-2M: 2,000,147 patents by the DeepPatent (2006~2015, from USPTO) \n? USPTO-3M: 3,050,615 patents, our new dataset with SQL statements (2000~2015, from Google Patents \nPublic Datasets on BigQuery) \n? 2006~2014: 1,950,247 patents out of USPTO-2M for DeepPatent. 1,933,105 patents for PatentBERT. \nMinor discrepancy exists due to different data sources and probably preprocessing criteria. \n? 2000~2014 : 2,900,615 patents out of USPTO-3M for PatentBERT \n(3) Testing dataset: \n? EPO: 1,350 patents \n? 2015-A: 49,900 patents out of USPTO-2M for DeepPatent. 49,670 patents for PatentBERT (out of \nUSPTO-3M and based on DeepPatent\u0027s list of test patents) \n? 2015-B: 150,000 of the 298,559 patents in 2015 (from USPTO-3M) \n? 2016: 150,000 of the 298,559 patents in 2016 (from BigQuery) \n? 2017: 150,000 of the 298,559 patents in 2017-01~2017-08 (from BigQuery) \n\nTable 1: Patent Classification Performance \n\n","rows":["EPO","EPO+WIP","CPC+Claim","2000~2014","N / A","IPC+Claim","2015 - B","2015 - A","( b )","( a )","2017","( f )","2016","IPC+Title+Abstract","( e )","2006~2014","DeepPatent","( c )","PatentBERT","( j )","( i )","( h )","( g )","( l )","( k )"],"columns":["( % )","N / A","Precision","Recall","\u003c 74","F1","\u003c 35","\u003c 45"],"mergedAllColumns":["Top 1","Top 5","O"],"numberCells":[{"number":"45.79","isBolded":false,"associatedRows":["( c )","DeepPatent","IPC+Title+Abstract","EPO+WIP","EPO","N / A"],"associatedColumns":["Precision","( % )","N / A","N / A"],"associatedMergedColumns":["O"]},{"number":"53.49","isBolded":false,"associatedRows":["( l )","PatentBERT","CPC+Claim","2000~2014","2017","N / A"],"associatedColumns":["Precision","Recall","( % )","N / A","N / A","\u003c 74"],"associatedMergedColumns":["Top 1"]},{"number":"63.74","isBolded":true,"associatedRows":["( g )","PatentBERT","IPC+Claim","2006~2014","2015 - A"],"associatedColumns":["Precision","F1","( % )","N / A","N / A","\u003c 45"],"associatedMergedColumns":["Top 1"]},{"number":"86.06","isBolded":false,"associatedRows":["( e )","PatentBERT","IPC+Title+Abstract","2006~2014","2015 - A","N / A"],"associatedColumns":["Precision","Recall","( % )","N / A","N / A","\u003c 74"],"associatedMergedColumns":["O"]},{"number":"55.09","isBolded":true,"associatedRows":["( c )","DeepPatent","IPC+Title+Abstract","EPO+WIP","EPO"],"associatedColumns":["Precision","F1","( % )","N / A","N / A"],"associatedMergedColumns":["O"]},{"number":"54.33","isBolded":false,"associatedRows":["( f )","PatentBERT","IPC+Title+Abstract","2006~2014","2015 - A","N / A"],"associatedColumns":["Precision","Recall","( % )","N / A","N / A","\u003c 74"],"associatedMergedColumns":["Top 5"]},{"number":"79.14","isBolded":false,"associatedRows":["( g )","PatentBERT","IPC+Claim","2006~2014","2015 - A","N / A"],"associatedColumns":["Precision","( % )","N / A","N / A","\u003c 35"],"associatedMergedColumns":["Top 1"]},{"number":"75.46","isBolded":false,"associatedRows":["( c )","DeepPatent","IPC+Title+Abstract","EPO+WIP","EPO","N / A"],"associatedColumns":["Precision","Recall","( % )","N / A","N / A"],"associatedMergedColumns":["O"]},{"number":"53.36","isBolded":false,"associatedRows":["( g )","PatentBERT","IPC+Claim","2006~2014","2015 - A","N / A"],"associatedColumns":["Precision","Recall","( % )","N / A","N / A","\u003c 74"],"associatedMergedColumns":["Top 1"]},{"number":"55.35","isBolded":false,"associatedRows":["( i )","PatentBERT","CPC+Claim","2006~2014","2015 - B","N / A"],"associatedColumns":["Precision","Recall","( % )","N / A","N / A","\u003c 74"],"associatedMergedColumns":["Top 1"]},{"number":"83.97","isBolded":false,"associatedRows":["( l )","PatentBERT","CPC+Claim","2000~2014","2017","N / A"],"associatedColumns":["Precision","( % )","N / A","N / A","\u003c 35"],"associatedMergedColumns":["Top 1"]},{"number":"83.98","isBolded":true,"associatedRows":["( a )","DeepPatent","IPC+Title+Abstract","EPO+WIP","EPO","N / A"],"associatedColumns":["Precision","( % )"],"associatedMergedColumns":[]},{"number":"84.89","isBolded":false,"associatedRows":["( k )","PatentBERT","CPC+Claim","2000~2014","2016","N / A"],"associatedColumns":["Precision","( % )","N / A","N / A","\u003c 35"],"associatedMergedColumns":["Top 1"]},{"number":"32.19","isBolded":false,"associatedRows":["( e )","PatentBERT","IPC+Title+Abstract","2006~2014","2015 - A","N / A"],"associatedColumns":["Precision","( % )","N / A","N / A","\u003c 35"],"associatedMergedColumns":["O"]},{"number":"55.38","isBolded":true,"associatedRows":["( h )","PatentBERT","CPC+Claim","2006~2014","2015 - A","N / A"],"associatedColumns":["Precision","Recall","( % )","N / A","N / A","\u003c 74"],"associatedMergedColumns":["Top 1"]},{"number":"65.35","isBolded":false,"associatedRows":["( l )","PatentBERT","CPC+Claim","2000~2014","2017"],"associatedColumns":["Precision","F1","( % )","N / A","N / A","\u003c 45"],"associatedMergedColumns":["Top 1"]},{"number":"84.26","isBolded":true,"associatedRows":["( h )","PatentBERT","CPC+Claim","2006~2014","2015 - A","N / A"],"associatedColumns":["Precision","( % )","N / A","N / A","\u003c 35"],"associatedMergedColumns":["Top 1"]},{"number":"84.24","isBolded":false,"associatedRows":["( i )","PatentBERT","CPC+Claim","2006~2014","2015 - B","N / A"],"associatedColumns":["Precision","( % )","N / A","N / A","\u003c 35"],"associatedMergedColumns":["Top 1"]},{"number":"64.91","isBolded":true,"associatedRows":["( f )","PatentBERT","IPC+Title+Abstract","2006~2014","2015 - A"],"associatedColumns":["Precision","F1","( % )","N / A","N / A","\u003c 45"],"associatedMergedColumns":["Top 5"]},{"number":"66.71","isBolded":true,"associatedRows":["( j )","PatentBERT","CPC+Claim","2000~2014","2015 - B"],"associatedColumns":["Precision","F1","( % )","N / A","N / A","\u003c 45"],"associatedMergedColumns":["Top 1"]},{"number":"54.92","isBolded":false,"associatedRows":["( j )","PatentBERT","CPC+Claim","2000~2014","2015 - B","N / A"],"associatedColumns":["Precision","Recall","( % )","N / A","N / A","\u003c 74"],"associatedMergedColumns":["Top 1"]},{"number":"80.61","isBolded":false,"associatedRows":["( f )","PatentBERT","IPC+Title+Abstract","2006~2014","2015 - A","N / A"],"associatedColumns":["Precision","( % )","N / A","N / A","\u003c 35"],"associatedMergedColumns":["Top 5"]},{"number":"66.83","isBolded":true,"associatedRows":["( h )","PatentBERT","CPC+Claim","2006~2014","2015 - A"],"associatedColumns":["Precision","F1","( % )","N / A","N / A","\u003c 45"],"associatedMergedColumns":["Top 1"]},{"number":"65.89","isBolded":false,"associatedRows":["( k )","PatentBERT","CPC+Claim","2000~2014","2016"],"associatedColumns":["Precision","F1","( % )","N / A","N / A","\u003c 45"],"associatedMergedColumns":["Top 1"]},{"number":"46.85","isBolded":true,"associatedRows":["( e )","PatentBERT","IPC+Title+Abstract","2006~2014","2015 - A"],"associatedColumns":["Precision","F1","( % )","N / A","N / A","\u003c 45"],"associatedMergedColumns":["O"]},{"number":"66.80","isBolded":true,"associatedRows":["( i )","PatentBERT","CPC+Claim","2006~2014","2015 - B"],"associatedColumns":["Precision","F1","( % )","N / A","N / A","\u003c 45"],"associatedMergedColumns":["Top 1"]},{"number":"73.88","isBolded":true,"associatedRows":["( b )","DeepPatent","IPC+Title+Abstract","2006~2014","2015 - A","N / A"],"associatedColumns":["Precision","( % )","N / A"],"associatedMergedColumns":["O"]},{"number":"84.95","isBolded":false,"associatedRows":["( j )","PatentBERT","CPC+Claim","2000~2014","2015 - B","N / A"],"associatedColumns":["Precision","( % )","N / A","N / A","\u003c 35"],"associatedMergedColumns":["Top 1"]},{"number":"53.84","isBolded":false,"associatedRows":["( k )","PatentBERT","CPC+Claim","2000~2014","2016","N / A"],"associatedColumns":["Precision","Recall","( % )","N / A","N / A","\u003c 74"],"associatedMergedColumns":["Top 1"]}]}]